images/PXL_20250306_124435746,Überprüfe deine Bauteile.;Eine CR2032-Batterie ist nicht enthalten. Du kannst sie online oder in größeren Elektronikgeschäften kaufen.; Die 3D-Druck Teile sind optional und können auch selbst gedruckt werden. Du findest die Dateien bei uns unter wiki.blinkyparts.com.
images/PXL_20250306_125243249, Nimm dir den LED-Abstandhalter (transparentes Röhrchen). Dieser hat eine geschlossene Seite mit zwei Löchern und eine offene Seite. Schneide von der offenen Seite etwa 5mm weg. Dein LED-Abstandhalter sollte nun noch etwa 10mm länge haben. Stecke eine LED druch die kleinen Löcher.;Stecke die LED (langes Beinchen ist das positive Beinchen) durch die Löcher LED1 Bottom. Das lange Beinchen gehört durch das Loch{,} welches mit einem Plus-Zeichen markiert ist.;Löte die LED von der anderen Seite fest.;Tipp: Löte zunächst nur ein Beinchen fest{,} so kannst du durch erneutes Erhizten die Position nochmal korrigieren.;Schneide danach die überstehenden Drahtstücke sehr knapp über der Oberfläche ab.
images/PXL_20250306_125947422,Stecke die LED2 Top und LED3 Top ein und löte diese fest. Achte wieder darauf{,} das lange Beinchen durch das Loch mit dem Plus zu stecken.;Löte die LEDs fest und schneide die überstehenden Drähte ab.
images/PXL_20250306_130519707-EDIT,Nimm den Reed-Schalter und biege vorsichtig die Beinchen. Achtung: Das Glasröhrchen ist sehr empfindlich.;Biege es soweit{,} dass du den Reed-Schalter in die Löcher bei SW1 stecken kannst. Der Schalter hat keine Richtung.;Stecke den Schalter nur soweit ein{,} bis die Drähte ganz leicht auf der anderen Seite aus den Löchern schauen.;Löte alles fest. Tipp: Hier kannst du auch von oben löten{,} statt auf der Rückseite.
images/PXL_20250306_131117225-EDIT,Nimm den Batteriehalter. Dieser hat eine Richtung. Der Umriss des Batteriehalters ist auf der Platine aufgezeichnet. Stecke diesen in die Löcher bei BT1{,} sodass die Umrisse mit dem Batteriehalter übereinstimmen.;Löte den Batteriehalter von der anderen Seite fest.;Du bist mit der Lötarbeit fertig. Lege eine CR2032 Batterie ein.
images/PXL_20250306_130829598,Nimm dir den Eierbecher zur Hand und entferne eventuelle Kunststoffreste am Rand bzw. im Loch in der Mitte.;Klebe den Neodymmagneten in die Vertiefung ein. Die Richtung spielt dabei keine Rolle.
images/PXL_20250306_131417393,Nimm dir das Ei zur Hand und bohre mit einem 5mm Borher im Bodenteil zentriert ein Loch.;
images/PXL_20250306_132514455,Stecke die Platine mit der lang abstehenden LED von innen durch das soeben gebohrte Loch.;Achte dabei darauf{,} dass der Reed-Schalter von innen die Eierschale berührt.;Fixiere die Platine mit 2-3 (Heiß-)klebepunkten.;Stecke danach die Oberseite vom Ei auf.
images/thumbnail,Stecke nun das Ei mit der LED nach unten in den Eierbecher.;Die LED sollte durch das Loch in der Mitte des Eierbechers passen.;Du kannst nun den Feuerstrahl von unten mit Heißkleber festmachen. Achte darauf, dass du die LED nicht auch mit festklebst.;Du bist fertig! Durch Drehen des Eies kannst du dieses einschalten.
