images/IMG_6939,Tipps:;Widerstandsgröße kann über Farbkodierung ermittelt werden;Ausrichtung der Platine so{,} dass LED-Bezeichnung normal gelesen werden kann (siehe Bild);Ausrichtung bei Widerständen ist egal;LEDs haben eine Flache Seite und ein kürzeres Beinchen. Beides zeigt die negative Seite an
images/IMG_6939,Widerstände R1 bis R7 (\SI{82}{\ohm}) einlöten;Ausrichtung ist egal
images/IMG_6939,IC1-Fassung mit der Nase nach links auf die Platine löten
images/IMG_6939,Schalter S1 auflöten;Tipp: Beinchen haben unterschiedliche Abstände. Es muss nichts verbogen werden. Schalter passt exakt
images/IMG_6939,Kondensator C1 (104) auflöten;Ausrichtung ist egal
images/IMG_6939,LED1 bis LED7 auflöten;Achtung! Ausrichtung wichtig. LEDs haben eine Flache Seite und ein kürzeres Beinchen. Beides zeigt die negative Seite an;Auf der Platine wird die negative Seite durch eine Abflachung dargestellt
images/IMG_6939,Stromanschluss X1 mit Öffnung nach unten
images/IMG_6939,IC1 mit der Nase nach links in Fassung einstecken;Tipp: Die Beinchen des ICs müssen leicht zurechtgebogen werden{,} um in die Fassung zu passen;Eventuell Isolierung an den Spitzen der Anschlusskabel der Batterie entfernen und verzinnen;Batterie anschrauben (+ rot{,} - schwarz);Batterien einlegen;Fertig!
