images/teileuebersicht,Prüfe{,} ob alle Teile vollständig vorhanden sind.
images/zuschneiden,Ziehe das Maßband vollständig aus dem Abroller und hänge es am Ende aus.;Lass die Feder in den Abroller zurückspringen.;Schneide die Metallplatte am Ende des Maßbands ab.;Schneide 4 Stücke mit folgenden Längen zu: \SI{1}x\SI{355}{\mm}{,} \SI{2}x\SI{150}{\mm}{,} \SI{1}x\SI{304}{\mm}.;Runde die Ecken der Stücke leicht ab.;Markiere auf den beiden langen Stücken mit einem Stift die Mitte.
images/schleifen,Schleife bei den beiden kurzen Maßbandstücken den Lack am nicht abgerundeten Ende auf einer Länge von etwa \SI{2}{\cm} ab.
images/loeten1,Nimm die Platine und die SMA-Buchse zur Hand.;Löte die SMA-Buchse auf die Platine.;Achte darauf{,} dass alle Lötstellen sauber und fest verlötet sind.
images/loeten2,Verteile eine großzügige Menge Lötzinn auf den großen Lötpads der Platine.;Trage auch auf der nach außen gebogenen Seite der Maßbänder ausreichend Lötzinn auf.;Löte die Maßbänder anschließend auf die Platine.;Tipp: Verwende etwas zusätzliches Lötzinn{,} um die Wärmeübertragung zwischen Lötkolben und Maßband zu verbessern.;Achte darauf{,} dass die Maßbänder parallel zueinander ausgerichtet sind.
images/schlauch,Nimm nun den Bewässerungsschlauch zur Hand.;Schneide den Schlauch in \SI{9} Stücke mit folgenden Längen: \SI{4}x\SI{15}{\mm}{,} \SI{2}x\SI{25}{\mm}{,} \SI{1}x\SI{100}{\mm}{,} \SI{1}x\SI{65}{\mm}{,} \SI{1}x\SI{75}{\mm}.
images/gewindestange,Stecke ein Ende des \SI{75}{\mm}-Schlauchs auf einen 4-Wege-Verteiler.;In die beiden seitlichen Anschlüsse (im 90°-Winkel) steckst du jeweils ein \SI{15}{\mm}-Schlauchstück.;Auf das freie Ende kommt der \SI{65}{\mm}-Schlauch.;An dessen Ende befestigst du den nächsten 4-Wege-Verteiler.;In dessen seitliche Anschlüsse kommen zwei \SI{25}{\mm}-lange Schlauchstücke.;An das verbleibende freie Ende steckst du den \SI{100}{\mm}-Schlauch.;Auch hier folgt ein 4-Wege-Verteiler.;An dessen seitliche Anschlüsse steckst du die beiden restlichen \SI{15}{\mm}-Schlauchstücke.;Schiebe nun die Gewindestange durch die langen Schlauchabschnitte.
images/kleber,Schiebe die Gewindestange auf einer Seite so weit in den Schlauch{,} dass sie bündig mit dessen Ende abschließt.;Schneide auf der gegenüberliegenden Seite den Überstand ab.;Verklebe beide Enden mit etwas Heißkleber.
images/schrumpfschlauch1,Schneide den kurzen Schrumpfschlauch mit Kleber in \SI{6} gleich große Stücke.;Lege die Maßbandabschnitte auf die Verteiler der Schlauchkonstruktion:;Das Band mit der Platine gehört in die Mitte{,} das lange Band an die Seite mit dem überstehenden Schlauch und der mittellange Streifen an die Seite mit dem kurzen Ende.
images/schrumpfschlauch2,Schiebe nun die Schrumpfschläuche von außen über die Maßbänder.;Wenn sie über den Verteilern positioniert sind{,} schrumpfe sie fest.;Achte dabei darauf{,} dass die Maßbänder mittig platziert sind – orientiere dich an den Markierungen.
images/schrumpfschlauch3,Schneide den langen Schrumpfschlauch in \SI{6} Stücke.;Diese sollten so lang sein{,} dass sie von der Mitte der Antenne bis kurz über die Enden der Maßbänder reichen.
images/thumbnail,Schrumpfe jetzt die langen Schrumpfschläuche auf die Maßbänder.;Achte darauf{,} dass die Enden der Maßbänder nicht hervorstehen{,} da sie sehr scharf sein können.