images/thumbnail,Tips: The resistor value can be determined via the printed colour coding;The orientation for resistors and capacitors is not important; Attention the orientation of diodes{,} LEDs{,} transistors and the coil is important and is described in detail in the respective step.
images/PXL_20211203_154820615,The THT components are not plugged in, but soldered on. First solder the resistor R1; Apply solder to one side; Then take the resistor and push it from the side into the reheated solder; Then solder the second side; Now remove the excess wires.
images/PXL_20211203_155502011,Solder on the Z-diode D3. Attention: The direction of the diode is important and is printed on the diode and the PCB. The black line on the diode must face in the direction of the white line on the PCB; solder the diode in place using the method as described; cut off the excess bits of wire.
images/PXL_20240530_070439081,Solder the capacitor C1 with the shown method. The direction is not important; cut off the excess wire.
images/PXL_20211203_160438335,Solder the transistor Q1; Attention the direction is important. The flat side must point downwards (also printed on the board); bend the middle leg upwards. Bend the outer legs at an angle of 120° (see picture); Solder the transistor according to the method shown; Cut off the excess wire.
images/PXL_20211203_171330388,Now solder on the LEDs D1 and D2. Attention: The orientation of the LED is important. The long leg indicates the positive side. A + is printed on the board (left pad).; Now bend the LEDs so that the tip of the LED points to the yellow area on the board (see picture).; Solder the LEDs in place using the method shown.; Cut off the excess bits of wire.
images/PXL_20211203_171506529,Bend the solder tags of the switch SW1 so that they can touch the PCB surface.; Solder the switch with the method as shown.
images/PXL_20240530_071928127,Remove about \SI{5}{\mm} of insulation from each side of the two wires; Join the wires to form a pair and wind the wire 10-12x through the ferrite core; Tin all open wire ends.
images/PXL_20240530_072144730,Now solder the coil T1. As you can see in the previous picture{,} there should be two wires in two colours coming out of each hole of the ferrite core (we call the colours of the wires colour F1 and colour F2). To tell the two sides of the coil apart{,} mark the wires of one side with a marker pen. On the board you will find four pads marked 1-4;Solder the coil to the board as follows:;F1 of the marked side to pad 1; F2 of the marked side to pad 2; F1 of the unmarked side to pad 4; F2 of the unmarked side to pad 3.
images/PXL_20211203_174428316,Solder the battery holder on; First shorten the wires to about \SI{60}{\mm} length; Remove about \SI{5}{\mm} of insulation from both wires; Tin the open ends; Solder the red wire to + of BT1; Solder the black wire to - of BT1; Glue the battery holder on the board with hot glue as shown. Make sure{,} that the battery holder is aligned with the bottom edge of the PCB.
images/PXL_20211206_100912916,You are done! Turn on the owl and let its eyes shine; (optional) You can put some hot glue on the back of the eyes{,} this will spread the light a bit better.
