images/Einzelpanels_engl03, So soll es am Ende aussehen.
images/Einzelpanels_engl04, Isoliere die Kabelenden ab.
images/Einzelpanels_engl05, Verzinne die Kontakte des Schalters.;Löte ein Kabel an die eine Seite des Schalters.
images/Einzelpanels_engl06, Löte eines der Motorkabel an den anderen Kontakt des Schalters.
images/Einzelpanels_engl07, Verlöte das zweite Motorkabel mit dem freien Kabel.
images/Einzelpanels_engl08, Biege die Pins des Batteriehalters nach innen.;Klemme die Kabel unter die Pins.
images/Einzelpanels_engl09, Verlöte beide Pins mit den Kabeln{,} so dass ein Stromkreis entsteht.
images/Einzelpanels_engl10, Drehe den Batteriehalter um und lege die Batterie mit dem + nach oben ein.;Probier's aus!
