images/PXL_20230311_184925574,Überprüfen deine Bauteile.;Die Batterien sind nicht enthalten. Du kannst sie online oder in größeren Elektronikgeschäften kaufen; Akkus eignen sich hervorragend und sind gut für die Umwelt.;Tipp: Wenn du die Bauteile festlötest{,} löte immer erst nur ein Beinchen an. Danach kannst du die Lötstelle nochmal aufwärmen und die Position korrigieren.;Achtung: Alle Teile auf dem Gras werden von der Seite aufgesteckt{,} von der die goldenen Grashalme zu sehen sind.;Achtung: Trage immer eine Schutzbrille. Wenn du Drähte abschneidest können diese unkontrolliert herumfliegen.
images/PXL_20230311_185359302,Löte zunächst die Widerstände R1-R3 fest.; Widerstände haben keine Richtung und die Werte von R1-R3 sind identisch. Es ist egal auf welcher Position du sie festlötest.;Schneide die überstehenden Drähte ab.
images/PXL_20230311_194654318,Löte den Schalter SW1 auf. Du musst dazu die Lötfahnen nach unten biegen{,} damit die Lötfahnen die Platine berühren.;Bring zunächst nur auf ein Pad Lötzinn auf{,} leg das Lötzinn zur Seite. Heize danach die Stelle wieder auf und schiebe den Schalter von der Seite darauf.
images/PXL_20230311_195604008,Löte das Potentiometer RV4 an.
images/PXL_20230311_200041041,Löte die Schalter Sw2-SW4 auf.;Hier ist der Tipp{,} zunächst nur ein Beinchen anzulöten{,} besonders hilfreich.;Schneide anschließend die überstehenden Drahtbeinchen ab.
images/PXL_20230311_200514221,Löte die Potentiometer RV1-RV3 auf.;Achtung: Achte hier besonders darauf{,} dass du die Bauteile von der richtigen Seite her einsteckst.;Schneie überstehende Drähte ab.
images/PXL_20230311_200958418,Nimm nun die Blüte und löte die RGB-LED auf.; Ein beichnen ist länger als alle Anderen. Dieses muss in das Loch mit den rechteckigen Lötpad (nicht abgerundete Ecken).;Achte darauf{,} dass keine Lötbrücken bestehen{,} benutze nicht zu viel Lötzinn.
images/PXL_20230311_201141329,Löte die geraden Pinleisten an die Blüte.; Stecke die kurze Seite von hinten durch die Blüte und löte die Beinchen von vorne fest.;
images/PXL_20230311_201348140,Löte den Blütenstiel von hinten an die lange Seite der Pinleiste.; Achte wieder darauf{,} dass sich die Beschriftung der Blüte und auch die Beschriftung des Blütenstiels auf der Rückseite befindet.
images/PXL_20230311_201739716,Löte die L-förmige Pinleiste auf den Blütenstil. Stecke dazu die Pinleiste von hinten durch den Stil und löte diesen von der Vorderseite fest.;Achte wieder darauf{,} dass die Pinleiste nicht schief aufgelötet wird.
images/PXL_20230311_202301752,Löte den Blütenstil auf die freien Löcher auf der Gras-Platine auf. Die großen Potentiometer sollten sich vor dem Stil befinden (siehe Foto).
images/PXL_20230311_202533988,Kürze die Kabel des Batteriehalteres auf etwa 5cm.;Nimm ein kleines Stück Isolierung von den Drahtenden ab und gib etwas Lötzinn darauf.
images/PXL_20230311_202947978,Stecke die Kabel von unten in die Löcher bei den Lötpads die mit BT1 und (+) markiert sind.; Achte darauf{,} dass das rote Kabel an der Stelle mit dem (+) eingelötet wird.; Löte beide Kabel fest.;Klebe die Grundplatine auf den Batteriehalter mit Heißkleber auf.;Stecke die Kappen auf die Potentiometer.
images/PXL_20230311_204436877,Du bist fertig! Mit dem Druckschalter auf der Rückseite kannst du deine Blume anschalten.;Mit den großen Potentiometern kannst du die Farben Blau{,} Rot und Grün einstellen. Die kleinen Schalter bei den Potenitometern können die Farben komplett zu oder abschalten.;Das kleine blaue Potentiometer auf der Rückseite stellt die Gesamthelligkeit ein. Achtung: Wenn du zu sehr aufdrehst{,} werden einzelne Farben abgeschalten.
