images/Heartbeat-Herz-Loetbausatz-fuer-anfaenger01,Check your components.;Tip: The resistance value can be determined by color coding.;The orientation of resistors does not matter.;LEDs have a flat side and a shorter leg. Both indicate the negative side.
images/Heartbeat-Herz-Loetbausatz-fuer-anfaenger02,Solder resistors R1 to R7. The resistors have different resistance values{,} which are marked by colored rings. Make sure you solder the correct resistor in the correct place.;Cut off any excess wire.
images/Heartbeat-Herz-Loetbausatz-fuer-anfaenger03,Attention: Q1-Q2 are BC547 and Q3 are BC557 transistors. The value is printed on the resistor.;Solder the BC557 transistor into Q3. Please note that a transistor has a flat side. The flat side should be positioned in the same place as printed on the circuit board.;You will need to bend the middle leg back slightly to get all three legs into the holes. Make sure that no solder bridges are created.
images/Heartbeat-Herz-Loetbausatz-fuer-anfaenger04,Solder the BC547 transistors Q1--Q2. Again{,} make sure they are facing the right direction.
images/Heartbeat-Herz-Loetbausatz-fuer-anfaenger05,The direction of the red ceramic capacitor does not matter. Now solder on the capacitors C1 (100nF{,} 104). Cut off any excess wires.
images/Heartbeat-Herz-Loetbausatz-fuer-anfaenger06,LEDs have a direction. The long leg is the anode (+). On the circuit board{,} the anode is marked by a round solder pad.; Insert the LED from the front into the holes marked with a circle. Caution: The long leg belongs in the hole with the round pad!
images/Heartbeat-Herz-Loetbausatz-fuer-anfaenger07,Turn the circuit board over!;Caution: Electrolytic capacitors (larger black cylinders) have a direction! The long leg is the anode (+). The anode is marked with a plus symbol (+) on the circuit board.;Insert the electrolytic capacitor FROM THE BACK into the two holes at the bottom corner of the heart. The long leg must go through the rectangular pad.; Make sure that there is about \SI{10}{\mm} of wire between the black cylinder and the circuit board. We will need to bend the electrolytic capacitor later. Solder the capacitor in place.
images/Heartbeat-Herz-Loetbausatz-fuer-anfaenger08,Finally{,} solder on the battery holder.;This also has a specific orientation. The outline is printed on the circuit board. Make sure that the outline matches the battery holder.;Tip: First solder only one leg in place. This allows you to correct the position as usual.
images/Heartbeat-Herz-Loetbausatz-fuer-anfaenger09,Bend the electrolytic capacitor to the side so that it lies flat on the circuit board next to the battery holder. Caution: The two legs must not touch each other!;Then insert a CR2032 battery.;You're done! The heart will now pulse for several weeks. If you want to turn it off{,} simply remove the battery.
